{
  "schemaVersion": 1,
  "fechaCorte": "2026-10-29",
  "politica": {
    "descripcion": {
      "es": "La agenda de revisión separa la vigilancia automática de la decisión editorial. Una alerta abre una revisión; no cambia por sí sola el catálogo, el estado de un expediente ni la evidencia de ejecución.",
      "en": "The review schedule separates automated monitoring from editorial decisions. An alert opens a review; it does not by itself change the catalog, a bill status or evidence of execution."
    },
    "automatizacion": {
      "es": "Los monitores y scrapers generan señales y propuestas de evidencia. Solo una revisión humana puede registrar un cambio publicado o una revisión sin cambios.",
      "en": "Monitors and scrapers generate signals and evidence proposals. Only human review can record a published change or a review with no changes."
    },
    "cadencias": [
      {
        "id": "semanal",
        "dias": 7,
        "diasAnticipacionHabiles": 1,
        "nombre": {
          "es": "Semanal",
          "en": "Weekly"
        },
        "aplicaA": {
          "es": "Expedientes legislativos y otros frentes con cambios de estado frecuentes.",
          "en": "Legislative bills and other areas with frequent status changes."
        }
      },
      {
        "id": "mensual",
        "dias": 31,
        "diasAnticipacionHabiles": 3,
        "nombre": {
          "es": "Mensual",
          "en": "Monthly"
        },
        "aplicaA": {
          "es": "ENIA, iniciativas en seguimiento e indicadores cercanos a una nueva edición.",
          "en": "ENIA, initiatives under review and indicators approaching a new edition."
        }
      },
      {
        "id": "trimestral",
        "dias": 92,
        "diasAnticipacionHabiles": 5,
        "nombre": {
          "es": "Trimestral",
          "en": "Quarterly"
        },
        "aplicaA": {
          "es": "Adopciones verificadas y arquitectura general del Marco país.",
          "en": "Verified adoption and the overall Country Framework architecture."
        }
      },
      {
        "id": "semestral",
        "dias": 184,
        "diasAnticipacionHabiles": 5,
        "nombre": {
          "es": "Semestral",
          "en": "Semiannual"
        },
        "aplicaA": {
          "es": "Ecosistema, capacidades e indicadores estructurales de publicación menos frecuente.",
          "en": "Ecosystem, capabilities and structural indicators published less frequently."
        }
      }
    ]
  },
  "frentes": [
    {
      "id": "legislacion-ia",
      "ambito": "legislacion",
      "metrica": "legislacion-expedientes",
      "nombre": {
        "es": "Expedientes relacionados con IA",
        "en": "AI-related bills"
      },
      "descripcion": {
        "es": "Revisión del estado, comisión y nueva actividad oficial de los siete expedientes catalogados.",
        "en": "Review of status, committee and new official activity for the seven cataloged bills."
      },
      "cadenciaId": "semanal",
      "fechaUltimaRevision": "2026-10-01",
      "fechaProximaRevision": "2026-10-08",
      "alcance": {
        "cantidad": 7,
        "unidad": {
          "es": "expedientes",
          "en": "bills"
        }
      },
      "fuenteUrl": "https://www.asamblea.go.cr/ca/Lists/cp/DispForm.aspx?ContentTypeId=0x01008922D325D4FE564292B03FD67DF003A7&ID=22860"
    },
    {
      "id": "enia-plan-accion",
      "ambito": "enia",
      "metrica": "enia-intervenciones-unicas",
      "nombre": {
        "es": "ENIA y Plan de Acción",
        "en": "ENIA and Action Plan"
      },
      "descripcion": {
        "es": "Control de versión de la estrategia, el PDF del Plan y evidencia externa sobre sus 120 intervenciones únicas. Los 129 registros fuente se conservan para auditoría.",
        "en": "Version monitoring for the strategy, the Action Plan PDF and external evidence on its 120 unique interventions. All 129 source records remain available for audit."
      },
      "cadenciaId": "mensual",
      "fechaUltimaRevision": "2026-09-15",
      "fechaProximaRevision": "2026-10-15",
      "alcance": {
        "cantidad": 120,
        "unidad": {
          "es": "intervenciones únicas",
          "en": "unique interventions"
        }
      },
      "fuenteUrl": "https://www.micitt.go.cr/gobierno_digital/inteligencia_artificial"
    },
    {
      "id": "catalogo-seguimiento",
      "ambito": "catalogo",
      "metrica": "catalogo-seguimiento",
      "nombre": {
        "es": "Iniciativas en seguimiento",
        "en": "Initiatives under review"
      },
      "descripcion": {
        "es": "Búsqueda prioritaria de evidencia sobre ejecución, técnica de IA, uso operativo, resultados y gobernanza.",
        "en": "Priority search for evidence on execution, AI technique, operational use, results and governance."
      },
      "cadenciaId": "mensual",
      "fechaUltimaRevision": "2026-09-15",
      "fechaProximaRevision": "2026-10-15",
      "alcance": {
        "cantidad": 16,
        "unidad": {
          "es": "iniciativas",
          "en": "initiatives"
        }
      },
      "fuenteUrl": "https://observatorioia.org/es/proyectos/"
    },
    {
      "id": "indicador-ilia",
      "ambito": "indicador",
      "metrica": "indicador-ilia",
      "nombre": {
        "es": "Índice Latinoamericano de IA",
        "en": "Latin American AI Index"
      },
      "descripcion": {
        "es": "Detección de una nueva edición o de cambios en el documento oficial del ILIA.",
        "en": "Detection of a new edition or changes to the official ILIA document."
      },
      "cadenciaId": "mensual",
      "notaCadencia": {
        "es": "La vigilancia aumenta a semanal entre septiembre y noviembre, cuando suelen publicarse nuevas ediciones.",
        "en": "Monitoring increases to weekly from September through November, when new editions are typically released."
      },
      "fechaUltimaRevision": "2026-09-16",
      "fechaProximaRevision": "2026-10-16",
      "alcance": {
        "cantidad": 1,
        "unidad": {
          "es": "índice",
          "en": "index"
        }
      },
      "fuenteUrl": "https://indicelatam.cl/"
    },
    {
      "id": "catalogo-verificado",
      "ambito": "catalogo",
      "metrica": "catalogo-verificado",
      "nombre": {
        "es": "Adopciones verificadas",
        "en": "Verified adoption"
      },
      "descripcion": {
        "es": "Revisión de continuidad operativa, nuevos resultados, cambios de alcance y salvaguardas públicas.",
        "en": "Review of operational continuity, new outcomes, scope changes and public safeguards."
      },
      "cadenciaId": "trimestral",
      "fechaUltimaRevision": "2026-09-08",
      "fechaProximaRevision": "2026-12-08",
      "alcance": {
        "cantidad": 10,
        "unidad": {
          "es": "adopciones",
          "en": "adoptions"
        }
      },
      "fuenteUrl": "https://observatorioia.org/es/proyectos/"
    },
    {
      "id": "marco-pais",
      "ambito": "marco-pais",
      "metrica": "marco-pais-instrumentos",
      "nombre": {
        "es": "Marco país",
        "en": "Country Framework"
      },
      "descripcion": {
        "es": "Revisión de vigencia, nuevas versiones y cambios institucionales en los instrumentos de política y gobernanza.",
        "en": "Review of validity, new versions and institutional changes across policy and governance instruments."
      },
      "cadenciaId": "trimestral",
      "fechaUltimaRevision": "2026-08-21",
      "fechaProximaRevision": "2026-11-21",
      "alcance": {
        "cantidad": 8,
        "unidad": {
          "es": "instrumentos",
          "en": "instruments"
        }
      },
      "fuenteUrl": "https://www.micitt.go.cr/gobierno_digital/inteligencia_artificial"
    },
    {
      "id": "catalogo-ecosistema",
      "ambito": "catalogo",
      "metrica": "catalogo-ecosistema",
      "nombre": {
        "es": "Ecosistema y capacidades",
        "en": "Ecosystem and capabilities"
      },
      "descripcion": {
        "es": "Revisión de continuidad, productos de investigación y posibles pasos hacia piloto u operación.",
        "en": "Review of continuity, research outputs and possible movement toward pilot or operation."
      },
      "cadenciaId": "semestral",
      "fechaUltimaRevision": "2026-08-21",
      "fechaProximaRevision": "2027-02-21",
      "alcance": {
        "cantidad": 16,
        "unidad": {
          "es": "iniciativas",
          "en": "initiatives"
        }
      },
      "fuenteUrl": "https://observatorioia.org/es/proyectos/"
    },
    {
      "id": "indicadores-oecd",
      "ambito": "indicador",
      "metrica": "indicador-oecd",
      "nombre": {
        "es": "DGI y OURdata de la OCDE",
        "en": "OECD DGI and OURdata"
      },
      "descripcion": {
        "es": "Control de nuevas ediciones, notas país, documentos de trabajo y correcciones de los indicadores.",
        "en": "Monitoring of new editions, country notes, working papers and corrections to the indicators."
      },
      "cadenciaId": "semestral",
      "fechaUltimaRevision": "2026-08-21",
      "fechaProximaRevision": "2027-01-01",
      "alcance": {
        "cantidad": 2,
        "unidad": {
          "es": "índices",
          "en": "indexes"
        }
      },
      "fuenteUrl": "https://www.oecd.org/en/publications/digital-government-outlook-2026_d46c0555-en/costa-rica_c3064731-en.html"
    }
  ],
  "revisiones": [
    {
      "id": "revision-legislacion-ia-2026-10-01",
      "notaValidacion": {
        "es": "Revisado en Delfino · validación en Asamblea pendiente",
        "en": "Reviewed via Delfino · Assembly verification pending"
      },
      "fecha": "2026-10-01",
      "frenteId": "legislacion-ia",
      "resultado": "sin-cambios",
      "resumen": {